Question_id,score,answers
8,5,العمل الصالح يشمل جميع الأعمال التي يقوم بها الإنسان بنية صافية لله وفقًا لتعاليم دينه
8,5,في الإسلام، العمل الصالح يشمل كل فعل يقوم به المسلم بنية الاقتراب من الله والامتثال لتوجيهاته
8,5,تعريف العمل الصالح يتطلب إخلاصًا لله والامتثال لشريعته في جميع الأعمال والأقوال
8,5,العمل الصالح يتطلب أن يكون المرء وفقًا لتوجيهات دينه وأن يكون قلبه خالصًا لله
8,5,في المفهوم الإسلامي، العمل الصالح يعبر عن التقوى والامتثال لأوامر الله بنية صافية
8,5,العمل الصالح يتسم بالإخلاص والامتثال لتعاليم الدين، ويكون للهدف من الطاعة لله
8,5,تعريف العمل الصالح يشمل كل فعل يقوم به الإنسان بنية إرضاء الله والتقرب إليه
8,5,في الإسلام، العمل الصالح يعتبر إيمانًا بأوامر الله واجتنابًا للمحرمات
8,4,العمل الصالح يتطلب من المؤمن أداء جميع الأعمال بنية الاقتراب من الله والتقرب إليه
8,4,تعريف العمل الصالح يعبر عن القيام بأفعال مرضية لله بنية خالصة وفقًا للشرع
8,4,في اللغة، العمل الصالح يعبر عن أي فعل يكون مرضيًا لله ويتسم بالإخلاص
8,4,العمل الصالح يشمل جميع الأعمال التي تقوم بها الإنسان بنية صافية لله وتحقيق للتقوى
8,4,تعريف العمل الصالح يتطلب من المؤمن أن يكون وفقًا لتعاليم دينه وبنية صافية
8,4,العمل الصالح يشمل جميع الأعمال التي تقوم بها الإنسان بنية إخلاص وامتثال للشريعة
8,4,في الإسلام، العمل الصالح يعبر عن إرادة المؤمن للامتثال لأوامر الله بصدق وإخلاص
8,4,تعريف العمل الصالح يتضمن الإخلاص والامتثال لشريعة الله في جميع الأعمال
8,4,العمل الصالح يشمل كل فعل يقوم به الإنسان بنية إرضاء الله والاقتراب منه
8,4,تعريف العمل الصالح يتضمن الامتثال لأحكام دين الإسلام والعمل بنية إخلاص
8,3,في المفهوم الإسلامي، العمل الصالح يشمل الأعمال التي تقوم بها الإنسان بنية طاعة الله
8,3,العمل الصالح يتطلب من المسلم أن يكون وفقًا للشريعة وبنية صافية لله
8,3,تعريف العمل الصالح يعبر عن الأعمال التي يقوم بها المؤمن بنية إرضاء الله
8,3,العمل الصالح يشمل جميع الأعمال التي تقوم بها الإنسان بنية الاقتراب من الله
8,3,تعريف العمل الصالح يتضمن الامتثال لأوامر الله والامتناع عن المحرمات بنية صافية
8,3,في الإسلام، العمل الصالح يتطلب من المؤمن أداء الواجبات وترك المحرمات بنية إخلاص
8,3,العمل الصالح يشمل جميع الأعمال التي تقوم بها الإنسان بنية إرضاء الله والامتثال لشريعته
8,2,تعريف العمل الصالح يعبر عن الأعمال التي يقوم بها الإنسان بنية التقرب من الله
8,2,العمل الصالح يتطلب من المؤمن أداء الفرائض والاجتناب عن المحرمات بنية خالصة
8,2,تعريف العمل الصالح يشمل الأعمال التي تقوم بها الإنسان بنية الامتثال لشرع الله
8,2,في المفهوم الإسلامي، العمل الصالح يتضمن الامتثال لأحكام دين الله بنية إخلاص
8,2,العمل الصالح يشمل جميع الأعمال التي تقوم بها الإنسان بنية الامتثال لتعاليم الدين
8,2,تعريف العمل الصالح يعبر عن الأعمال التي يقوم بها الإنسان بنية إرضاء الله والتقرب منه
8,2,العمل الصالح يتطلب من المؤمن أداء الواجبات والتحلي بالخلق الحسن بنية صافية
8,2,تعريف العمل الصالح يشمل الأعمال التي تقوم بها الإنسان بنية الامتثال لأوامر الله
8,2,في الإسلام، العمل الصالح يتطلب من المؤمن أداء الفرائض وترك المحرمات بنية خالصة
8,2,العمل الصالح يشمل جميع الأعمال التي تقوم بها الإنسان بنية إرضاء الله وتحقيق للتقوى
8,1,تعريف العمل الصالح يعبر عن الأعمال التي يقوم بها الإنسان بنية التقرب من الله
8,1,العمل الصالح يتطلب من المؤمن أداء الفرائض والتحلي بالخلق الحسن بنية صافية
8,1,تعريف العمل الصالح يشمل الأعمال التي تقوم بها الإنسان بنية الامتثال لأوامر الله
8,1,في المفهوم الإسلامي، العمل الصالح يتضمن الامتثال لأحكام دين الله بنية إخلاص
8,1,العمل الصالح يشمل جميع الأعمال التي تقوم بها الإنسان بنية الامتثال لتعاليم الدين
8,1,تعريف العمل الصالح يعبر عن الأعمال التي يقوم بها الإنسان بنية إرضاء الله والتقرب منه
8,1,العمل الصالح يتطلب من المؤمن أداء الواجبات والاجتناب عن المحرمات بنية خالصة
8,3,تعريف العمل الصالح يشمل الأعمال التي تقوم بها الإنسان بنية التقرب من الله
8,3,في المفهوم الإسلامي، العمل الصالح يتضمن الامتثال لأحكام دين الله بنية إخلاص
8,3,العمل الصالح يشمل جميع الأعمال التي تقوم بها الإنسان بنية الامتثال لتعاليم الدين
8,3,تعريف العمل الصالح يعبر عن الأعمال التي يقوم بها الإنسان بنية إرضاء الله والتقرب منه
8,3,العمل الصالح يتطلب من المؤمن أداء الواجبات والتحلي بالخلق الحسن بنية صافية
8,3,تعريف العمل الصالح يشمل الأعمال التي تقوم بها الإنسان بنية الامتثال لأوامر الله
8,3,في المفهوم الإسلامي، العمل الصالح يتضمن الامتثال لأحكام دين الله بنية إخلاص
8,3,العمل الصالح يشمل جميع الأعمال التي تقوم بها الإنسان بنية الامتثال لتعاليم الدين
8,2,تعريف العمل الصالح يعبر عن الأعمال التي يقوم بها الإنسان بنية إرضاء الله 
8,2,في سياق العمل الصالح، يعني الإخلاص أن تكون نوايا الفرد خالصة لله وليس للبشر، حيث يقوم بالأعمال الصالحة لوجه الله دون التركيز على ما يعتقده الناس
8,2,العمل الصالح يمكن أن يظهر في مختلف جوانب الحياة، سواء كان ذلك في الأعمال الخيرية، أو الأخلاق الحسنة، أو الامتثال للأوامر الدينية
8,2,في سياق العمل الصالح، يمكن أن يكون التواضع جزءًا أساسيًا، حيث يعبر الفرد عن امتنانه لله من خلال العطاء وتقديم المساعدة دون تكبر أو انتظار الشكر
8,2,العمل الصالح يشمل البذل والإحسان إلى الناس، حيث يسعى الفرد لتقديم يد العون والدعم للآخرين دون الانتظار مقابل أو مكافأة
8,4,في سياق العمل الصالح، يتعلق الأمر بتطوير النفس وتحسين العلاقات الاجتماعية، حيث يعتبر الفرد العمل الصالح فرصة للنمو الشخصي والتأثير الإيجابي على المحيط
8,4,العمل الصالح يشمل الالتزام بالعدالة وتحقيق التوازن في المجتمع، حيث يُشجع على محاربة الظلم وتعزيز العدالة والمساهمة في بناء مجتمع أكثر إنصافًا
8,4,في سياق العمل الصالح، يتعلق الأمر بالتواضع والتواصل الفعّال، حيث يُشجع على التفاعل الإيجابي مع الآخرين وبناء علاقات صحية ومثمرة
8,4,العمل الصالح يمكن أن يكون مظهرًا من مظاهر التعبير عن الشكر والامتنان، حيث يقدر الفرد نعم الله ويسعى لترجمة هذا الشعور إلى أفعال صالحة
8,4,في سياق العمل الصالح، يُؤكد على أهمية التعلم المستمر وتطوير المهارات، حيث يُعَدّ التحسن الشخصي جزءًا لا يتجزأ من الالتزام بالعمل الصالح
8,4,العمل الصالح يمكن أن يكون وسيلة للتأثير الإيجابي على البيئة، حيث يُشجع على الحفاظ على الطبيعة وتبني سلوكيات صديقة للبيئة
8,4,في سياق العمل الصالح، يتعلق الأمر بتعزيز روح التعاون والتضامن، حيث يسهم الفرد في بناء مجتمع يسوده التعاون والتكاتف
8,1,العمل الصالح يمكن أن يظهر في الالتزام بالوعود والصدق في العلاقات الشخصية والمهنية، حيث يُشجع على بناء علاقات قائمة على الثقة والنزاهة
8,1,في سياق العمل الصالح، يُحَثّ على الابتعاد عن الأخلاقيات الضارة والمحرمات، حيث يعتبر الفرد تجنب المعاصي جزءًا من الالتزام بالعمل الصالح
8,1,العمل الصالح يشمل الاستماع الفعّال والتعبير عن التقدير، حيث يُشجع على بناء علاقات إيجابية وتعزيز الفهم المتبادل
8,1,في سياق العمل الصالح، يتعلق الأمر بالاستدامة والمسؤولية الاجتماعية، حيث يُشجع على اتخاذ القرارات التي تسهم في رفاهية المجتمع والعالم
8,1,العمل الصالح يمكن أن يظهر في الصبر والتحمل في مواجهة التحديات، حيث يعتبر الفرد التفاؤل والصمود جزءًا من العمل الصالح
8,5,في سياق العمل الصالح، يتعلق الأمر بتعزيز ثقافة السلم وتحقيق التسامح، حيث يُشجع على حل النزاعات بطرق سلمية وبناء جسور التواصل
8,5,العمل الصالح يمكن أن يظهر في العناية بالصحة النفسية والبدنية، حيث يُشجع على تحقيق التوازن بين العمل والحياة الشخصية
8,5,في سياق العمل الصالح، يتعلق الأمر بالابتعاد عن الغيبة والنميمة والأمور الضارة للعلاقات الاجتماعية
8,5,العمل الصالح يشمل الاستماع للآخرين وفهم وجهات نظرهم، حيث يُشجع على التعاطف والتضامن مع الآخرين
8,5,في سياق العمل الصالح، يتعلق الأمر بتعزيز قيم التواضع والتسامح، حيث يُشجع على الاحترام المتبادل والتقدير لتنوع الآراء والخلفيات
8,5,العمل الصالح يمكن أن يظهر في السعي لتحقيق التميز والإبداع في مجالات مختلفة من الحياة
8,5,في سياق العمل الصالح، يتعلق الأمر بالتفاني في خدمة الآخرين وتقديم العون في اللحظات الصعبة
8,5,العمل الصالح يشمل الاستثمار في التعلم المستمر وتطوير المهارات الشخصية والمهنية
8,5,في سياق العمل الصالح، يتعلق الأمر بالتفكير الإيجابي ونشر الطاقة الإيجابية في المحيط
8,5,العمل الصالح يمكن أن يظهر في الالتزام بالقيم الأخلاقية والأخلاقيات الدينية في كل جوانب الحياة
8,1,في سياق العمل الصالح، يُحَثّ على الابتعاد عن الغضب الزائد والتحكم في الانفعالات السلبية
8,1,العمل الصالح يشمل البحث عن الفرص لخدمة المجتمع والمساهمة في حل المشاكل الاجتماعية
8,1,في سياق العمل الصالح، يتعلق الأمر بالتفكير الاستراتيجي وتحديد الأهداف والمساهمة في تحقيقها
8,2,العمل الصالح يمكن أن يظهر في الالتزام بالعدالة ومحاربة أشكال الظلم والاضطهاد
8,3,في سياق العمل الصالح، يتعلق الأمر بالتفاعل الإيجابي مع التكنولوجيا والابتكار لتحقيق تحسين في الحياة اليومية
8,3,العمل الصالح يشمل الابتعاد عن السلوكيات الضارة والإسهام في بناء مجتمع صحي وآمن
8,4,في سياق العمل الصالح، يتعلق الأمر بالحفاظ على النزاهة والتصدي للفساد والظلم في المؤسسات والمجتمع
8,4,العمل الصالح يمكن أن يظهر في الدعوة إلى الخير ونشر الوعي بالقضايا الاجتماعية والبيئية
8,1,في سياق العمل الصالح، يُشَجَّع على الاستماع إلى الرأي الآخر والتعاون لتحقيق التقدم والتطوير
8,0,العمل الصالح هو العمل بالضغينة والكراهية
8,0,العمل بالظلم والاستغلال
8,0,العمل الصالح هو العمل بالخداع والغش
8,0, العمل الشرير والمؤذي
8,0,العمل الصالح هو العمل بالتسلط والاستبداد
8,0, العمل الغير أخلاقي والمخالف للقيم الدينية
8,0,العمل الصالح هو العمل بالعنف والتعذيب
8,0,هو العمل بالنفاق والزيف
8,0,العمل بدون خير وعطاء
8,0,العمل الصالح هو العمل بالتعصب والتطرف
8,0,هو العمل بالتمييز والتفضيل الجائر
8,0,العمل بالتدليس والكذب
8,0,العمل الصالح هو العمل بالتحيز والتمييز العرقي
8,0,هو العمل بالكسل وعدم الاجتهاد
8,0,العمل الصالح هو العمل بالتخريب والتدمير
8,0,العمل بالرياء والمظهرية فقط
8,0,العمل بالمآرب الشخصية والانتهازية
8,0, العمل بالإسراف والتبذير
8,0,الانتقام والإيذاء للآخرين
8,0,هو العمل بالفساد والفساد المالي
9,3,الصيام هو الإمساك عن المفطرات من طلوع الفجر إلى غروب الشمس 
9,3,الصيام هو الامتناع عن الطعام والشراب والأعمال السيئة من طلوع الفجر إلى غروب الشمس 
9,4,الصيام يعني الامتناع عن تناول الطعام والشراب والممارسات السلبية والمحرمات من طلوع الفجر حتى غروب الشمس خلال شهر رمضان
9,2,الصيام هو فرض من فرائض الإسلام
9,5,الصيام هو فرض من فرائض الإسلام يتمثل في الامتناع عن الطعام والشراب والعلاقات الحميمية من طلوع الفجر إلى غروب الشمس
9,3,الصيام يعني الامتناع عن تناول الطعام والشراب
9,4,الصيام هو عملية تمتد من طلوع الفجر إلى غروب الشمس في شهر رمضان تشمل الامتناع عن الطعام والشراب والسلوكيات السلبية
9,3,الصيام هو التحكم في الشهوات
9,5,الصيام هو ركن من أركان الإسلام يتضمن الامتناع عن الأكل والشرب والمفطرات من طلوع الفجر إلى غروب الشمس
9,5,الصيام هو عبادة تقوم على الامتناع عن الطعام والشراب والمفطرات والسلوكيات السلبية خلال فترة معينة من النهار في رمضان
9,5,الصيام هو فرض ديني يتضمن الامتناع عن الأكل والشرب والمفطرات من طلوع الفجر إلى غروب الشمس خلال شهر رمضان
9,5,الصيام هو التزام يتضمن الامتناع عن الطعام والشراب والمفطرات من الفجر حتى الغروب في شهر رمضان
9,2,الصيام هو عبادة تتضمن الامتناع عن الأكل والشراب
9,2,امتناع عن الطعام والشراب نهارًا في شهر رمضان
9,2,عدم تناول الطعام أو الشراب من طلوع الفجر حتى الغروب في شهر رمضان
9,2,التحكم في الشهوات والامتناع عن الطعام والشراب من الفجر حتى الغروب في رمضان
9,4,التعبُّدُ لله سبحانَه وتعالى، بالإمساكِ عن الأكلِ والشُّربِ وسائِرِ المُفَطِّراتِ، مِن طُلوعِ الفَجرِ إلى غُروبِ الشَّمسِ
9,4,تجنب الأكل والشرب خلال أوقات النهار خلال شهر رمضان
9,4,صوم النهار في شهر رمضان وعدم تناول الطعام والشراب
9,4,الصيام هو دلالة على الثبات والمداومة على فعل الإمساك عن المفطرات من الأكل والشراب وغيرها من مفطرات الصيام من وقت طلوع الفجر حتى غروب الشمس
9,4,يعني الامتناع عن شهوة البطن من الأكل والشرب وشهوة الفرج
9,4,الصيام هو الأمر الشرعي المراد به الإمساك عن مفطرات الصيام
9,5,الْإِمْسَاكُ عَنْ شَهْوَتَيِ الْبَطْنِ وَالْفَرْجِ مِنْ طُلُوعِ الْفَجْرِ إِلَى غُرُوبِ الشَّمْسِ بِنِيَّةِ التَّقَـرُّبِ إلى الله تعالى
9,3,الامتناع عن ثلاثة مُفطرات، وهي الأكل والشرب والجماع
9,3,الامتناع عن شهوتي الفرج والفم
9,3,الإمساك عن المفطرات على وجه مخصوص، وشروط مخصوصة من طلوع الفجر الثاني، إلى غروب الشمس
9,3,هو أحد أركان الإسلام الخمسة
9,4,ترك الطعام والشراب والنكاح والكلام
9,4,عندما تغرب الشمس يأكل الصائم ويشرب امتثالاً لأمر الله وإذا طلع الفجر يمسك عن الأكل والشرب وسائر المفطرات
9,4,هو عبادة بين العبد وربه جل وعل
9,5,الصيام شرعاً: هو الإمساك عن شهوتي البطن والفرج، أي المفطرات، من طلوع الفجر الصادق، إلى غروب الشمس مع النية، وينقسم إلى واجب ومستحب
9,5,الصيام هو دلالة على الثبات والمداومة على فعل الإمساك عن المفطرات من الأكل والشراب وغيرها من مفطرات الصيام من وقت طلوع الفجر حتى غروب الشمس
9,5,الصيام مشتق من الصوم و يعني الامتناع عن شهوة البطن من الأكل والشرب وشهوة الفرج
9,1,فرض صيام رمضان في السنة الثانية للهجرة في شهر شعبان
9,1,صوم شهر رمضان من كل عام
9,2,يجب على كل مسلم، مكلف بالغ عاقل، مطيق للصوم، صحيح، مقيم، غير معذور
9,2,فُرض الصيام على المسلمين في السنة الثانية من الهجرة النبوية المشرفة وهو العام الذي شرع الله تعالى الصيام على المسلمين كعبادة من العبادات المفروضة عليهمv
9,2,يمثل الصوم مناسبة للتذكير بالله والتوجه إليه بالعبادة والطاعة، حيث يمنح الفرد فرصة للابتعاد عن الشهوات والدنيا والتفكير في الأمور الروحانية
9,1,يساعد الصوم على تعليم الصبر والتحمل والتخفيف من التمنيات الدنيوية
9,2,الصوم ليس مجرد الإمساك عن الأكل والشرب. كما أنه يمتنع عن أنواع السلوك السلبي مثل الكذب والغش والقتال وما إلى ذلك
9,1,الصوم في الإسلام هو عبادة
9,1,الصَّوم لغةً: الإمساكُ
9,2,الصيام هو أحد أركان الإسلام الخمسة ويعتبر واجبًا على المسلمين البالغين والمكتفين الصحة
9,2,الصيام هو تعبير عن التقرب إلى الله وتجديد الروح وتنقية النفس
9,2,الصيام يعزز الصبر والتحمل والتواضع
9,2,الصيام يعمل على تنقية الجسم وتطهيره من السموم
9,2,الصيام يعزز الوعي بالنعمة والشكر لله على الرزق
9,2,الصيام يعلم المسلمين ضبط النفس والتحكم في الرغبات الجسدية
9,2,الصيام يعزز الرحمة والتعاطف مع الفقراء والمحتاجين
9,2,الصيام يعزز الانضباط الروحي والتحكم في الشهوات النفسية
9,2,الصيام يعزز الاستقلالية وعدم الاعتماد الكلي على الطعام والشراب
9,2,الصيام يعلم الصبر والتحمل في مواجهة الصعاب والابتلاءات
9,2,الصيام يعزز الروابط العائلية والاجتماعية من خلال وجبة الإفطار المشتركة
9,0,الصيام هو الإفساد والفساد الأخلاقي
9,0,الصيام هو الاحتفال والترفيه والتسلية
9,0,الصيام هو الإفراط في الأكل والشرب بعد الإفطار
9,0,الصيام هو الامتناع عن الصلاة والذكر
9,0,الصيام هو الأكل والشرب في وقت الصوم دون قيود
9,0,الصيام هو العمل بالكسل والتكاسل
9,0,الصيام هو الاحتفال بالاستهلاك الزائد والتبذير
9,0,الصيام هو الامتناع عن الصلاة والعبادة
9,0,الصيام هو الاستمتاع بالمناسبات الاجتماعية والولائم
9,0,الصيام هو الآكل الجائع والعطشان
9,0,الصيام هو تناول الطعام والشراب بشكل كبير في الليل في رمضان
9,0,الصيام هو النوم لمدة طويلة في نهار رمضان
9,0,الصيام هو الصلاة بكثافة خلال شهر رمضان
9,0,الصيام هو الامتناع عن الأكل والشراب ولكن لفترات قصيرة في رمضان
9,0,الصيام هو تناول الطعام ولكن بكميات أقل في رمضان
9,0,الصيام هو الامتناع عن شرب الماء فقط خلال النهار في رمضان
10,4,تحفيز الناس على ممارسة الأعمال الصالحة وترك المعاصي
10,4,نشر الإسلام والتوعية بمبادئه وقيمه
10,4,دعم الأشخاص في تحقيق السعادة والسلام الداخلي
10,4,توجيه الناس نحو الطريق الصحيح والقريب من الله
10,4,تثقيف الجمهور حول العقائد الإسلامية الصحيحة
10,4,تعزيز القيم الأخلاقية والأخلاق الحميدة في المجتمع
10,4,توعية الناس بأهمية العبادة والاقتراب من الله
10,4,تقديم الدعم والمساعدة للأشخاص في حل مشاكلهم الشخصية
10,3,تعزيز التعاون والتضامن في المجتمع المسلم
10,3,تعزيز التسامح والتعايش السلمي بين أفراد المجتمع
10,3,تشجيع الناس على تحقيق التوازن بين الحياة الدنيا والآخرة
10,3,توجيه الناس في اتخاذ القرارات الصائبة والمناسبة
10,3,توعية الناس بأهمية العدل والإنصاف في المعاملات
