Question_id,score,answers
5,2,الركوع والسجود كعلامة للتذلل أمام الله
5,2,الاستماع إلى آيات الله بتأمل واعتبار
5,2,التواضع والرضا بقضاء الله وقدره
5,2,الشكر لله في كل نعمة صغيرة وكبيرة
5,1,التدبر في حكم الله في الواقع اليومي
5,1,تقدير قدرة الله على خلق الحياة
5,1,الاستغفار والعودة إلى الله بعد الزلات
5,1,التفكير في عظمة الله في خلق الإنسان
5,1,الرضا بما قسمه الله والاستسلام للقدر
5,1,البحث عن الحكمة في أحكام الله
5,1,الابتهاج بتحقيق الأمنيات برعاية الله
5,1,التذكير بفضل الله في السعادة والنجاح
5,1,العمل الجاد والاجتهاد بنية إرضاء الله
5,3,التحلي بالصبر في مواجهة التحديات
5,3,الاستماع إلى القرآن وتأمل معانيه
5,3,البحث عن الحقيقة والمعرفة بإرشاد الله
5,3,الاعتزاز بالإسلام وتقدير نعم الهداية
5,3,الاستغفار والتوبة لرضا الله العلي القدير
5,3,الحفاظ على النعمة الصحية بشكر الله
5,3,المشاركة في الأعمال الخيرية بتوجيه الله
5,3,التفكير في عمق السماء وابتهاج بخلق الله
5,3,الاعتناء بالبيئة احتراماً لخلق الله
5,3,التفاؤل بالخير والبركة من الله
5,2,التواضع والاستقامة في العمل والعبادة
5,2,التدبر في معاني الأذكار والأدعية
5,2,التحلي بالأخلاق الإسلامية في التعامل
5,2,الابتهاج بالنجاحات الصغيرة بتوفيق الله
5,2,الصدق والنية الطيبة في الأعمال اليومية
5,2,التذكير بفضل الله في الراحة والأمان
5,2,الاحتفاء بذكرى نعم الله في الحياة
5,2,التفكير في عظمة الله في خلق الطبيعة
5,2,الابتسامة والفرح باللحظات الجميلة
5,2,العمل بنية خدمة الآخرين بتوجيه الله
5,1,التفكير في عظمة الله في إبداع الألوان
5,1,الدعاء بالراحة والتسهيل في الحياة
5,1,التركيز على الشكر والامتنان يومياً
5,1,الاستعانة بالله في كل القرارات
5,3,التواصل الجيد مع الآخرين بتوجيه الله
5,2,التأمل في حكمة الله في توجيه الأمور
5,1,الرغبة في تحقيق الخير بإرادة الله
5,3,التفكير في عظمة الله في تنوع الكائنات
5,3,التواضع والاستشعار برعاية الله الدائمة
5,0,الثناء على الله هو عبادة أشياء أخرى بجانبه
5,0,الثناء على الله هو تجاهل وجوده
5,0,هو القسوة والظلم
5,0,عدم الاعتراف بقدرته
5,0,هو تكريس العبادة لآلهة أخرى
5,0,الثناء على الله هو الشك والتردد في وجوده
5,0,الثناء على الله هو الإساءة والسب والشتم
5,0,هو الانحراف عن طريق الحق
5,0,الثناء على الله هو الجحود وعدم الاعتراف بنعمه
5,0,الثناء على الله هو الاستهزاء والسخرية منه
5,0,الثناء على الله هو الانكار والجحود لرسله
5,0,الثناء على الله هو التحريف والتزوير في كتابه
5,0,الثناء على الله هو الاستغفال والتضليل للناس
5,0,هو الإلحاد والتكفير
5,0,الخداع والغش في العبادة
5,0,لثناء على الله هو العبادة للأصنام والأوثان
5,0,الثناء على الله هو الاعتقاد بأنه غير قادر على الخلق والبناء
6,5,الصِّحة رزق، والأبناء رزق، والصُّحبة الصالحة رزق، والزوجة الصالحة رزقٌ لزوجها، وكذلك الزوج الصالح رزقٌ لزوجته، والوالدان رزق، والإيمان رزق، والعمل الصالح الذي يعمله العبد رزق، إلى غير ذلك من الأمور.
6,3,المال
6,3,الصحة
6,3,الابناء
6,3,الصحبة الصالحة
6,3,الزوجة الصالحة 
6,3,كل ما ينتفع به من مال او زرع 
6,3,هو ما يتهيأ للعبد من الله عز وجل بلا سعي منه ولا نية لتحصيله
6,5,هو ما يقسم الله تعالى لعباده من الطَعام والشراب واللباس
6,4,كل ما يمكن الانتفاع به واستهلاكه
6,3,الوالدان
6,3,الإيمان
6,3,العمل الصالح
6,5,الرزق هو جميع ما يأتي من الله للإنسان من نعم ورحمة
6,5,ما يُعطى للإنسان من الله تعالى من الطعام والشراب والمال والأولاد
6,4,رزق الإنسان يشمل كل ما يحتاجه للحياة الكريمة والاستمرار
6,2,هو اللطف والعناية التي يُولى الله بها لخلقه
6,3,كل ما يتمتع به الإنسان من خيرات الحياة
6,1,الرزق هو كل ما يُعطى للإنسان من الله ليعيش حياة كريمة
6,5,رزق الإنسان يشمل النعم المادية والروحية التي يحتاجها في حياته
6,2,رزق الإنسان هو اللهونة والعناية التي يُولى إليها من قِبل الله
6,4,الرزق هو النعم والفضائل التي يُعطيها الله للإنسان
6,4,كل ما يأتي من الله للإنسان من فضل ونعمة
6,3,الرزق هو كل ما يحتاجه الإنسان للعيش بكرامة
6,5,كل ما يأتي للإنسان من الله سواء كان مالًا أو صحة أو عقل
6,3,رزق الإنسان يشمل كل ما يُعينه على العيش براحة
6,3,الرزق هو كل ما يُمكن الإنسان من العيش بكرامة واستقرار
6,3,رزق الإنسان يشمل النعم الروحية والمادية
6,2,الرزق هو اللهونة والعناية التي يُولى إليها الإنسان
6,3,كل ما يأتي من الله للإنسان يُعتبر رزقًا
6,3,الرزق هو كل ما يُعطى للإنسان من الله ليحيا حياة كريمة
6,2,رزق الإنسان يشمل كل ما يُساعده على العيش براحة
6,3,كل ما يأتي للإنسان من الله يُعتبر جزءًا من رزقه
6,2,الرزق هو اللهونة والعناية التي يُولى الله بها لخلقه
6,3,كل ما يأتي للإنسان من الله يُعتبر رزقًا من السماء
6,3,الرزق هو كل ما يحتاجه الإنسان للعيش براحة
6,1,رزق الإنسان يشمل كل ما يحتاجه في حياته اليومية
6,3,كل ما يأتي للإنسان من الله سواء كان ماديًا أو روحيًا
6,3,كل ما يأتي للإنسان من الله يُعتبر رزقًا
6,3,الرزق هو كل ما يحتاجه الإنسان للعيش براحة
6,2,الرزق هو اللهبة التي تضيء حياة الإنسان وتسهم في سعادته
6,2,كل ما يأتي من الله للفرد سواء كان ذلك في مجال الصحة أو المال أو العلم
6,2,الرزق هو النعمة التي لا يمكن للإنسان أن يحصل عليها بمفرده دون إرادة الله
6,3,كل ما يحتاجه الإنسان للعيش بكرامة هو جزء من الرزق
6,2,الرزق هو ما يمكن الإنسان من تحقيق أهدافه وتطوير حياته
6,2,الرزق هو الثقة التي يضعها الله في عباده ليتحملوا مسؤوليات الحياة
6,2,الرزق هو مظهر من مظاهر رحمة الله التي تشمل جميع جوانب حياة الإنسان
6,2,الرزق هو النعمة التي يجب على الإنسان أن يشكر الله عليها بكل حال
6,3,كل ما يأتي بفضل الله في حياة الإنسان يعتبر جزءًا من الرزق
6,3,الرزق هو اللهبة الحية التي تحافظ على حياة الإنسان
6,3,كل ما يأتي بفعل إرادة الله وبركة رحمته يعد جزءًا من الرزق
6,3,الرزق هو القوة التي تمكن الإنسان من التغلب على التحديات في حياته
6,3,الرزق هو النعمة التي تأتي من الله دون أن يكون للإنسان دور في اختيارها
6,3,الرزق هو الطاقة التي يحصل عليها الإنسان ليواجه تحديات الحياة
6,3,كل ما يسهم في تحسين جودة حياة الإنسان هو نتيجة لإرادة الله ورزقه
6,2,الرزق هو السلام والرضا الذي يشعر به الإنسان عندما يكون مقبولًا عند الله
6,3,الرزق هو النعمة التي تظهر في حياة الإنسان على شكل فرص وتحديات
6,3,الرزق هو الثقة التي يمنحها الله للإنسان ليحقق أهدافه وطموحاته
6,3,الرزق هو الحب والدعم الذي يأتي من الله ويجعل الحياة أكثر إشراقًا
6,2,الرزق هو الفرصة التي يمنحها الله للإنسان ليحقق أحلامه وطموحاته
6,3,كل ما يأتي بإرادة الله وبركة رحمته يعتبر رزقًا للإنسان
6,1,الرزق هو السرور والسعادة التي يشعر بها الإنسان عندما يكون على خير
6,3,كل ما يأتي من الله ويجعل حياة الإنسان أفضل هو جزء من الرزق
6,1,الرزق هو النعمة التي يحملها الإنسان في قلبه ويعيشها في حياته
6,0,الرزق هو الحصول على القوة السحرية والأعمال الشيطانية
6,0,الاعتماد على الحظ والأبراج الفلكية
6,0,الرزق هو القوة الجسدية والتضحية بالصحة من أجله
6,0,السيطرة على الآخرين واستغلالهم
6,0,الرزق هو الانتقام والإيذاء لأعدائك
6,0,هو الاحتكار والاستيلاء على موارد الآخرين
6,0,الرزق هو الحصول على الأمور بواسطة السحر والشعوذة
6,0,الرزق هو الاعتماد على القوى الخارقة والأرواح
6,0,الاستغلال الاقتصادي والاحتكار التجاري
6,0,العبادة والانقياد الكامل للقوى الخارقة
6,0,الاستخدام السلبي للعلوم والتكنولوجيا
6,0,الاستغلال البشري والعبودية الاقتصادية
6,0,الرزق هو العبادة للأرواح الشريرة والكائنات الخارقة
6,0,الرزق هو الاستغلال الاجتماعي والظلم الاقتصادي
6,0,الرزق هو الاستغلال البيئي وتدمير الموارد الطبيعية
6,0,هو الاعتماد على الأموال المنهوبة والمال الغير مشروع
6,0,الرزق هو الاعتماد على الألعاب المقامرة والقمار
6,0,الرزق هو السيطرة والقوة على الآخرين
6,0,الرزق هو الاستمتاع بالمتع الحرام
6,0,الرزق هو الحصول على الأمور بدون جهد
7,5,الرياء هو قيام الإنسان بأعمال صالحة بهدف أن يشاهدها الناس ويحصل على إعجابهم
7,5,في المفهوم الديني، يُعرف الرياء بأداء العبادات بهدف إظهارها للناس لنيل إعجابهم والحصول على تقديرهم
7,5,الرياء يعبر عن التضليل في أداء الأعمال الصالحة لغرض الحصول على إعجاب الناس وليس لله
7,5,يُعتبر الرياء مخالفة للنيّة الصافية في أداء العبادات، حيث يجب أن تكون النية لله وحده
7,5,في اللغة، يعني الرياء قصد الإنسان للقيام بأعمال لفت انتباه الناس وليس انطلاقاً من إيمانه الحقيقي
7,5,الرياء يظهر عندما يكون الإنسان يرغب في إظهار فعل الخير للناس دون أن يكون قلبه صافياً لله
7,5,في المعنى الشرعي، الرياء يعبر عن القيام بالأعمال لنيل رضا الناس وليس لله
7,4,الرياء يعد نوعًا من النفاق، حيث يظهر الإنسان صورة خاطئة عن نيته الحقيقية في أداء العبادات
7,4,الرياء يتعارض مع مفهوم الإخلاص والإيمان الحقيقي في العبادة
7,4,في السياق الإسلامي، يُحذر من الرياء ويشدد على أهمية الإخلاص في الأعمال الدينية
7,4,الرياء يظهر عندما يكون هدف الإنسان هو إرضاء الناس دون أن يكون همه إرضاء الله
7,4,في القرآن الكريم والسنة النبوية، يتم التأكيد على ضرورة الإخلاص في الأعمال وتجنب الرياء
7,4,الرياء يعبر عن السعي لتحقيق مظهر خارجي صالح أمام الناس دون اهتمام بالنية الحقيقية
7,4,يُعتبر الرياء من السلوكيات الخاطئة والمذمومة في الإسلام
7,2,في المفهوم الشرعي، يعتبر الرياء فشلًا في الالتزام بالإيمان والإخلاص
7,2,الرياء يشير إلى تناقض بين الظاهر والباطن في الأعمال الدينية
7,2,الرياء ينطوي على تضليل الناس بصورة غير صحيحة حول نوايا الفرد في أداء العبادات
7,2,في الفقه الإسلامي، يتم تحديد صحة العمل بناءً على النية الصافية والإخلاص لله وحده
7,2,الرياء يعبر عن انحراف النية عن الهدف الحقيقي للعبادة
7,2,الرياء يشمل إظهار العبادات للناس بغية الحصول على الشهرة والإعجاب
7,2,في السياق الإسلامي، يُعتبر الرياء إثمًا يؤثر على صحة الأعمال الدينية
7,2,الرياء يعبر عن القصد الخاطئ في أداء الأعمال الدينية
7,2,الرياء يعكس ضياع النية الصافية والإخلاص في العبادة
7,2,في الإسلام، يتم التأكيد على أهمية الإخلاص في الأعمال الدينية وتجنب الرياء
7,2,الرياء يعبر عن رغبة الإنسان في الحصول على إعجاب الناس على حساب رضى الله
7,2,الرياء يؤدي إلى فقدان قيمة الأعمال الدينية ويجعلها باطلة
7,1,الرياء يعبر عن عدم الالتزام بالنية الصافية في الطاعات
7,1,الرياء يتعارض مع مفهوم السرية في العبادات والأعمال الخيرية
7,1,الرياء يعبر عن استخدام الدين لأغراض شخصية واجتماعية
7,1,في الإسلام، يُحذر من الرياء ويشجع على النية الصافية في الطاعات
7,1,الرياء يشمل تضليل الناس بظهور صورة غير حقيقية عن الفرد في أداء العبادات
7,1,في الفقه الإسلامي، يُعتبر الرياء خيانة للنية الصافية والإخلاص
7,1,الرياء يعبر عن التناقض بين السلوك الظاهر والنية الخفية في العبادات
7,1,الرياء يعد من السلوكيات المرفوضة والتي تتنافى مع القيم الدينية
7,3,في الفهم الشرعي، الرياء يعبر عن انحراف النية عن الطريق الصحيح في العبادات
7,3,الرياء يظهر عندما يكون هدف الإنسان هو إظهار فضيلته للناس دون أن يكون قلبه خالصًا لله
7,3,الرياء يعبر عن تشويه العبادات بهدف الحصول على إعجاب الناس
7,3,في السياق الإسلامي، يُعتبر الرياء إثمًا يؤثر على صحة الأعمال الدينية
7,3,الرياء يعكس ضياع النية الصافية والإخلاص في العبادة
7,3,في الإسلام، يتم التأكيد على أهمية الإخلاص في الأعمال الدينية وتجنب الرياء
7,3,الرياء يعبر عن رغبة الإنسان في الحصول على إعجاب الناس على حساب رضى الله
7,3,الرياء يؤدي إلى فقدان قيمة الأعمال الدينية ويجعلها باطلة
7,3,الرياء يعبر عن عدم الالتزام بالنية الصافية في الطاعات
7,3,الرياء يتعارض مع مفهوم السرية في العبادات والأعمال الخيرية
7,3,الرياء يعبر عن استخدام الدين لأغراض شخصية واجتماعية
7,3,في الإسلام، يُحذر من الرياء ويشجع على النية الصافية في الطاعات
7,3,الرياء يشمل تضليل الناس بظهور صورة غير حقيقية عن الفرد في أداء العبادات
7,1,في الفقه الإسلامي، يُعتبر الرياء خيانة للنية الصافية والإخلاص
7,1,الرياء يعبر عن التناقض بين السلوك الظاهر والنية الخفية في العبادات
7,1,الرياء يعد من السلوكيات المرفوضة والتي تتنافى مع القيم الدينية
7,1,في الفهم الشرعي، الرياء يعبر عن انحراف النية عن الطريق الصحيح في العبادات
7,1,الرياء يظهر عندما يكون هدف الإنسان هو إظهار فضيلته للناس دون أن يكون قلبه خالصًا لله
7,2,الرياء يعبر عن تشويه العبادات بهدف الحصول على إعجاب الناس
7,2,في السياق الإسلامي، يُعتبر الرياء إثمًا يؤثر على صحة الأعمال الدينية
7,2,الرياء يعكس ضياع النية الصافية والإخلاص في العبادة
7,2,في الإسلام، يتم التأكيد على أهمية الإخلاص في الأعمال الدينية وتجنب الرياء
7,2,الرياء يعبر عن رغبة الإنسان في الحصول على اعجاب الاخرين عند قيامه بالعبادة
7,2,الرياء يعني أداء العبادة لله بنية الإعجاب والمدح من الناس
7,2,في اللغة، يُفهم الرياء على أنه القيام بالأعمال ليروها الناس ويمدحوا بها
7,2,الرياء يشير إلى القصد بالأعمال للحصول على إعجاب الناس وليس لله تعالى
7,2,في اللغة، الرياء يعبر عن أداء الأعمال للحصول على إشادة وإعجاب الناس
7,2,الرياء يعني أداء الأعمال للحصول على إعجاب الناس وتقديرهم
7,1,تعريف الرياء يرتبط بقصد الإنسان إظهار أعماله للناس للحصول على تقديرهم
7,4,الرياء يتضمن إخفاء النوايا الحقيقية والقيام بالأعمال للحصول على إعجاب الناس
7,4,في اللغة، الرياء يتعلق بأداء الأعمال بهدف إظهارها للناس وجذب إعجابهم
7,4,تعريف الرياء يشمل القيام بالأعمال بهدف الحصول على مدح وإعجاب الناس
7,4,الرياء يعبر عن السعي للإشادة والثناء من الناس من خلال أداء الأعمال
7,1,تعريف الرياء في الدين يعني أداء الأعمال الصالحة بهدف جذب إعجاب الناس
7,1,الرياء يشمل القيام بالأعمال بقصد جذب إعجاب وإشادة الناس
7,1,الرياء يعكس عملًا يُقدم للناس بقصد الحصول على إعجابهم
7,3,في المصطلح الإسلامي، الرياء يعتبر خطأً يتضمن إخفاء النيات الحقيقية
7,3,الرياء يشمل عملًا يُظهر للناس بنية جلب إعجابهم وتقديرهم
7,3,في اللغة، الرياء يشمل القيام بالأعمال بهدف جذب إعجاب الناس
7,3,تعريف الرياء يرتبط بقصد الإنسان جلب إعجاب الناس من خلال الأعمال
7,3,الرياء يشمل القيام بالأعمال للحصول على إعجاب الناس دون النية الحقيقية لله تعالى
7,3,تعريف الرياء يعبر عن تحويل النية في الأعمال لتحقيق إعجاب وإشادة الناس
7,3,في المصطلح الإسلامي، الرياء يعتبر مخالفة للنوايا الحقيقية في العبادات
7,3,الرياء يتضمن القيام بالأعمال لتحقيق إعجاب وإشادة الناس دون نية صافية لله تعالى
7,3,تعريف الرياء يشمل عملًا يُظهر للناس بهدف جلب إعجابهم وتحقيق التقدير
7,3,الرياء يعبر عن تعمد الشخص إظهار أعماله للناس للحصول على تقديرهم
7,3,في اللغة، الرياء يشمل القيام بالأعمال بهدف جذب إعجاب الناس
7,3,تعريف الرياء يرتبط بقصد الإنسان تحقيق الإشادة والإعجاب من الناس من خلال الأعمال
7,1,الرياء يتعلق بأداء الأعمال بهدف جلب إعجاب الناس وتحقيق التقدير
7,1,تعريف الرياء يتضمن القيام بالأعمال للحصول على إعجاب الناس دون نية صافية لله تعالى
7,1,في المصطلح الإسلامي، الرياء يعتبر مخالفة للنوايا الحقيقية في العبادات
7,1,الرياء يتضمن القيام بالأعمال لتحقيق إعجاب وإشادة الناس دون النية الحقيقية لله تعالى
7,2,تعريف الرياء يشمل عملًا يُظهر للناس بهدف جلب إعجابهم وتحقيق التقدير
7,2,الرياء يعبر عن تعمد الشخص إظهار أعماله للناس للحصول على تقديرهم
7,2,في اللغة، الرياء يشمل القيام بالأعمال بهدف جذب إعجاب الناس
7,2,تعريف الرياء يرتبط بقصد الإنسان تحقيق الإشادة والإعجاب من الناس من خلال الأعمال
7,2,الرياء يتعلق بأداء الأعمال لله بنية جلب إعجاب ومدح الناس
7,1,تعريف الرياء يتعلق بتحويل نية العمل لتحقيق إعجاب وتقدير الناس
7,0,الرياء هو الإيمان الصادق والعمل الصالح
7,0,هو الصدق والإخلاص في العبادة
7,0,الإصرار على العدل والإنصاف
7,0,الرياء هو الاهتمام برضا الله فقط دون مراعاة الناس
7,0,الرياء هو الالتزام بالقيم الأخلاقية والأخلاق الحميدة
7,0,الرياء هو الانتباه لاحتياجات الآخرين ومساعدتهم
7,0,العمل بصدق وإخلاص من أجل الله
7,0, العمل الخيري والإحسان للمحتاجين
7,0,هو الإلتزام بالعدل والأمانة في الأعمال
7,0,الرياء هو الإيثار والتضحية من أجل الآخرين
7,0,الرياء هو العمل بشكل متواضع وبعيد عن الاستعراض
7,0, العمل بالصدق والأمانة في الكلمة والعمل
7,0,الرياء هو الالتزام بالمساواة والعدل في المعاملات
7,0,الرياء هو العمل بالإخلاص والإيمان دون الاستعراض
7,0,العمل بالإخلاص والتفاني في خدمة الناس
7,0,الرياء هو الالتزام بالأخلاق والقيم السامية في الحياة
7,0,هو الاحترام والتقدير لحقوق الآخرين
7,0,الرياء هو العمل بالإيثار والمساعدة على الخير
7,0,الرياء هو العمل بالصدق والثقة والتزام الوعود
8,4,هو العمل الذي يرضي الله
8,5,العمل الصالح يعني القيام بأفعال تكون مرضية لله تعالى وتتسم بالإخلاص والامتثال لشرعه
8,5,في اللغة، العمل الصالح يشمل كل ما يفعله الإنسان بنية صافية لله ووفقًا لشريعته
8,5,تعريف العمل الصالح يتضمن القيام بأعمال تكون مقبولة عند الله وتحمل في طياتها الإخلاص والتقوى
