Question_id,score,answers
1,4,السورة رقم 2 في القرآن
1,4,السورة الثانية في القرآن
1,4,ثاني سورة في القرآن
1,5,أطول سورة في القرآن الكريم هي سورة البقرة
1,5,البقرة
1,5,السورة هي البقرة
1,5,اطول سورة هي البقرة
1,5,البقرة هي اطول سورة
1,5,هي البقرة
1,5,سورةالبقرة 
1,4,سورة البقرة في القرآن
1,5,البقرة هي أطول سورة في الكتاب المقدس
1,5,سورة البقرة هي السورة الأطول في القرآن الكريم
1,4,في القرآن، أطول سورة هي البقرة
1,3,سورة البقرة تأتي في المرتبة الثانية في القرآن
1,4,البقرة هي السورة الثانية والأطول في القرآن
1,4,سورة البقرة تحتل المرتبة الثانية في ترتيب السور
1,3,البقرة هي سورة القرآن الثانية وأطولها
1,4,سورة البقرة هي السورة الثانية وأكبر سورة في القرآن الكريم
1,4,في الكتاب المقدس، البقرة هي أطول سورة
1,3,سورة البقرة هي السورة الثانية في القرآن
1,4,البقرة هي سورة القرآن الثانية والأطول في الكتاب المقدس
1,2,سورة البقرة تأتي في المرتبة الثانية في ترتيب السور
1,5,سورة البقرة هي أطول سورة في القرآن
1,5,تعد سورة البقرة أطول سورة في القرآن
1,5,أطول سورة في القرآن هي سورة البقرة
1,3,سورة البقرة تأتي في المرتبة الأولى من حيث الطول في القرآن
1,3,سورة البقرة تحتل المرتبة الأعلى من حيث الطول في القرآن
1,3,في القرآن، تأتي سورة البقرة في صدارة السور من حيث الطول
1,4,سورة البقرة هي السورة الأكثر طولًا في القرآن
1,5,في القرآن الكريم، تُعتبر سورة البقرة هي الأطول
1,4,هناك سورة واحدة تبرز في القرآن بطولها، وهي سورة البقرة
1,4,سورة البقرة هي السورة ذات الطول الأكبر في القرآن الكريم
1,4,سورة البقرة هي الأطول من بين سور القرآن
1,4,سورة البقرة تعتبر الأطول من حيث عدد آياتها في القرآن
1,4,السورة الأطول في القرآن هي سورة البقرة
1,4,سورة البقرة تأتي في المقدمة من حيث الطول في القرآن
1,4,سورة البقرة تحتوي على أكبر عدد من الآيات في القرآن
1,3,السورة التي تأتي في الصدارة بالنسبة للطول في القرآن هي سورة البقرة
1,4,سورة البقرة تحتل المرتبة الأولى بين سور القرآن من حيث الطول
1,3,سورة البقرة تعد أطول سورة في القرآن من حيث مدة تلاوته
1,2,السورة الأكثر تفصيلاً وشمولًا في القرآن هي سورة البقرة
1,3,في القرآن الكريم، تأتي سورة البقرة في الصدارة بالنسبة للطول
1,2,سورة البقرة تحتوي على أكبر عدد من الصفحات في القرآن
1,2,سورة البقرة تعتبر السورة الأكثر تفصيلاً وشمولًا في القرآن
1,2,السورة التي تستغرق أطول وقت لتلاوتها هي سورة البقرة
1,2,سورة البقرة تحتوي على أعلى عدد من الكلمات في القرآن
1,2,سورة البقرة تعد السورة الأكثر تفصيلاً وغنىً في مضمونها في القرآن
1,2,سورة البقرة تحتوي على أكبر عدد من الفقرات في القرآن
1,2,السورة الأكثر ضخامة في القرآن هي سورة البقرة
1,2,سورة البقرة تتميز بأنها السورة الأكثر تفصيلاً وتعقيدًا في القرآن
1,3,سورة البقرة تحتل المرتبة الأولى بين سور القرآن من حيث الحجم والطول
1,0,أطول سورة في القرآن هي
1,0,أطول سورة في القرآن هي سورة النجم
1,0,سورة القدر
1,0,سورة الفاتحة
1,0,سورة الإخلاص
1,0,الفلق
1,0,أطول سورة في القرآن هي سورة الكوثر
1,0,أطول سورة في القرآن هي سورة النصر
1,0,هي سورة الكافرون
1,0,أطول سورة في القرآن هي سورة العصر
1,0,سورة الفيل
1,0,سورة الهمزة
1,0,قريش
1,0,أطول سورة في القرآن هي سورة العاديات
1,0,أطول سورة في القرآن هي سورة الأسراء
1,0,سورة الروم
1,0,أطول سورة في القرآن هي سورة الشمس
1,0,الضحى
1,0,سورة الإنسان
2,5,اقصر واحدة هي الكوثر
2,5,الكوثر
2,5,الكوثرهي اقصر سورة
2,5,هي الكوثر
2,5,سورةالكوثر
2,5,اقصر سورة في القرآن هي الكوثر
2,5,اقصر سورة هي الكوثر
2,5,أقصر سورة في القرآن الكريم هي سورة الكوثر
2,5,أقصر سورة في القرآن الكريم هي:الكوثر
2,5,الكوثرهي اقصر سورة في القران
2,5,أقصر سورة في القرآن الكريم هي سورة الكوثر
2,5,أقصر سورة في القرآن الكريم هي: الكوثر
2,5,الكوثرهي اقصر سورة في القران
2,5,سورة الكوثر هي الأقصر في القرآن
2,5,سورة الكوثر هي الأقصر في القرآن الكريم
2,5,الكوثر هي أقصر سورة في القرآن
2,1,سورة الكوثر هي السورة رقم 108 في القرآن الكريم
2,3,الكوثر هي سورة قصيرة تتألف من ثلاث آيات
2,2,سورة الكوثر تعد واحدة من السور المكية
2,2,الكوثر هي سورة مكية نزلت على النبي محمد صلى الله عليه وسلم
2,1,سورة الكوثر تعبر عن فضل الله على النبي محمد صلى الله عليه وسلم
2,1,الكوثر تعني الخير والنعمة الوفيرة التي وهبها الله
2,1,سورة الكوثر تبين عظمة الله وكرمه تجاه النبي صلى الله عليه وسلم
2,1,الكوثر تحث على شكر الله والرجوع إليه في كل الأمور
2,1,سورة الكوثر تحمل في مضمونها الرسالة الإيمانية والتوجيه الإلهي
2,2,الكوثر تذكر المسلمين بأهمية الشكر والامتنان لنعم الله
2,5,الكوثر هي أقصر سورة في القرآن الكريم
2,5,سورة الكوثر هي أقصر سورة في القرآن
2,4,تعتبر سورة الكوثرأصغر سورة في القرآن الكريم
2,4,سورة الكوثر تأتي في المرتبة الأولى من حيث القصر في القرآن
2,5,أقصر سورة في القرآن هي سورة الكوثر
2,4,في القرآن، تأتي سورة الكوثر في صدارة السور من حيث القصر
2,4,سورة الكوثر تحتل المرتبة الأدنى من حيث الطول في القرآن
2,4,السورة الأقل طولًا في القرآن هي سورة الكوثر
2,3,سورة الكوثر هي السورة التي تأتي في النهاية بالنسبة للقصر في القرآن
2,4,سورة الكوثر هي السورة الأقل طولًا في القرآن
2,2,سورة الكوثر تحتوي على عدد قليل جدًا من الكلمات والآيات
2,3,سورة الكوثر هي السورة ذات القصر الأكبر في القرآن الكريم
2,4,في القرآن الكريم، تُعتبر سورة الكوثر هي الأقصر
2,1,سورة الكوثر هي السورة التي يتعلمها الأطفال في بداية دراسة القرآن
2,3,هناك سورة واحدة تبرز في القرآن بقصرها، وهي سورة الكوثر
2,2,سورة الكوثر تحتوي على عدد قليل جدًا من الكلمات والآيات
2,2,في سورة الكوثر، يتم التركيز على فضل الله وكرمه للنبي محمد صلى الله عليه وسلم
2,2,سورة الكوثر تتميز بأنها السورة الأقل تعقيدًا في القرآن
2,1,سورة الكوثر تحتوي على رسالة قصيرة وهامة للمؤمنين
2,2,سورة الكوثر تعد واحدة من السور القصيرة والمفيدة في القرآن
2,2,سورة الكوثر تعلمنا أن العمل الصالح والإحسان هما طريق النجاح والسعادة
2,2,سورة الكوثر تذكرنا بأن الله هو المنعم الحقيقي والمؤتمن على كل خير
2,2,سورة الكوثر تعد بمثابة تذكير للمسلمين بأهمية العطاء والسخاء
2,2,في سورة الكوثر، يوجه الله تعالى النبي محمد صلى الله عليه وسلم بالشكر والحمد
2,2,في سورة الكوثر، يتم تشجيع المسلمين على العمل الصالح والعطاء
2,2,سورة الكوثر تعلم المسلمين أن النجاح الحقيقي يأتي من الله وبفضله
2,2,في سورة الكوثر، يتم حث المسلمين على البذل والعطاء للمحتاجين
2,2,سورة الكوثر تحثنا على السخاء والعطاء للآخرين
2,2,سورة الكوثر تدعو المسلمين إلى الاحتفال بنعم الله والشكر له
2,2,سورة الكوثر تذكرنا بأن الله هو الكافي والمعطي الكريم
2,2,في سورة الكوثر، يتم التركيز على أهمية التواضع والشكر لله
2,2,سورة الكوثر تذكرنا بأن الله يمنحنا الخير بغزارة وسخاء
2,2,سورة الكوثر تعلمنا أن الله يحب العمل الصالح والعبادة الخالصة
2,0,أقصر سورة في القرآن هي سورة الفاتحة
2,0,هي سورة الإخلاص
2,0,الفلق
2,0,النصر هي أقصر سورة في القرآن الكريم
2,0,سورة الكافرون الأقصر في الكتاب المقدس
2,0,سورة قريش
2,0,سورة العاديات
2,0,سورة الاسراء
2,0,سورة الضحى
2,0,سورة الشمس
2,0,الروم
2,0,هي سورة العصر
2,0,سورة الفيل
2,0,سورة الهمزة
2,0,البقرة
3,5,اسم زوجة فرعون في القرآن الكريم هي أسية بنت مزاحم
3,4,أسية هو اسم زوجة فرعون
3,4,اسم زوجته هو أسية
3,4,اسمها هوأسية
3,4,اسم زوجة فرعون هوأسية
3,4,اسمها:أسية
3,4,أسية
3,5,أسية بنت مزاحم
3,4,اسم زوجة فرعون والتي ذكرت في القرآن الكريم هوأسية
3,4,في القرآن الكريم، اسم زوجة فرعون هو أسية بنت مزاحم
3,4,أسية هي الزوجة التي ذكرت في القرآن الكريم مع فرعون
3,4,في الكتاب المقدس، أسم زوجة فرعون هو أسية
3,5,أسية بنت مزاحم كانت زوجة فرعون
3,4,زوجة فرعون في القرآن الكريم هي أسية
3,5,في القرآن الكريم، زوجة فرعون تدعى أسية بنت مزاحم
3,4,أسية هي الزوجة التي تحدث عنها القرآن في قصة فرعون
3,4,في الكتاب المقدس، يُذكر اسم زوجة فرعون بأسية
3,5,أسية بنت مزاحم، هي الزوجة التي ذكرت في القرآن مع فرعون
3,4,في سفر القرآن، يذكر اسم زوجة فرعون بأسية
3,4,أسية هي امرأة فرعون التي ذُكرت في الكتاب المقدس
3,4,في القرآن، يتحدث عن زوجة فرعون واسمها أسية
3,5,أسية بنت مزاحم، الزوجة التي ذُكرت مع فرعون في القرآن
3,5,في القرآن الكريم، امرأة فرعون تُدعى أسية بنت مزاحم
3,4,أسية هي الزوجة التي تظهر في القصة مع فرعون في القرآن
3,4,في الكتاب المقدس، يُذكر اسم زوجة فرعون بأسية
3,5,أسية بنت مزاحم، زوجة فرعون الذكرى في القرآن
3,4,في القرآن الكريم، يُذكر اسم زوجة فرعون بأسية
3,4,أسية هي الزوجة التي ذُكرت في قصة فرعون في الكتاب المقدس
3,5,زوجة فرعون في القرآن تُدعى أسية بنت مزاحم
3,5,أسية بنت مزاحم، امرأة فرعون في القرآن الكريم
3,5,أسية بنت مزاحم
3,4,اسم زوجة فرعون والتي ذكرت في القرآن الكريم هو أسية
3,5,في القرآن الكريم، اسم زوجة فرعون هو أسية بنت مزاحم
3,4,أسية هي الزوجة التي ذكرت في القرآن الكريم مع فرعون
3,4,في الكتاب المقدس، أسم زوجة فرعون هو أسية
3,5,أسية بنت مزاحم كانت زوجة فرعون
3,4,زوجة فرعون في القرآن الكريم هي أسية
3,5,في القرآن الكريم، زوجة فرعون تدعى أسية بنت مزاحم
3,4,أسية هي الزوجة التي تحدث عنها القرآن في قصة فرعون
3,4,في الكتاب المقدس، يُذكر اسم زوجة فرعون بأسية
3,5,أسية بنت مزاحم، هي الزوجة التي ذكرت في القرآن مع فرعون
3,4,في سفر القرآن، يذكر اسم زوجة فرعون بأسية
3,4,أسية هي امرأة فرعون التي ذُكرت في الكتاب المقدس
3,4,في القرآن، يتحدث عن زوجة فرعون واسمها أسية
3,5,أسية بنت مزاحم، الزوجة التي ذُكرت مع فرعون في القرآن
3,5,في القرآن الكريم، امرأة فرعون تُدعى أسية بنت مزاحم
3,4,أسية هي الزوجة التي تظهر في القصة مع فرعون في القرآن
3,4,في الكتاب المقدس، يُذكر اسم زوجة فرعون بأسية
3,5,أسية بنت مزاحم، زوجة فرعون الذكرى في القرآن
3,4,في القرآن الكريم، يُذكر اسم زوجة فرعون بأسية
3,4,أسية هو الزوجة التي ذُكرت في قصة فرعون في الكتاب المقدس
3,5,زوجة فرعون في القرآن تُدعى أسية بنت مزاحم
3,5,أسية بنت مزاحم، امرأة فرعون في القرآن الكريم
3,4,اسم زوجة فرعون والتي ذكرت في القرآن الكريم هو أسية
3,5,في القرآن الكريم، اسم زوجة فرعون هو أسية بنت مزاحم
3,4,أسية هو الزوجة التي ذكرت في القرآن الكريم مع فرعون
3,4,في الكتاب المقدس، أسم زوجة فرعون هو أسية
3,5,أسية بنت مزاحم كانت زوجة فرعون
3,4,زوجة فرعون في القرآن الكريم هي أسية
3,5,في القرآن الكريم، زوجة فرعون تدعى أسية بنت مزاحم
3,4,أسية هي الزوجة التي تحدث عنها القرآن في قصة فرعون
3,4,في الكتاب المقدس، يُذكر اسم زوجة فرعون بأسية
3,5,أسية بنت مزاحم، هي الزوجة التي ذكرت في القرآن مع فرعون
3,4,في سفر القرآن، يذكر اسم زوجة فرعون بأسية
3,4,أسية هي امرأة فرعون التي ذُكرت في الكتاب المقدس
3,4,في القرآن، يتحدث عن زوجة فرعون واسمها أسية
3,5,أسية بنت مزاحم، الزوجة التي ذُكرت مع فرعون في القرآن
3,5,في القرآن الكريم، امرأة فرعون تُدعى أسية بنت مزاحم
3,3,أسيا
3,3,أسيا - وفقًا للتراث اليهودي
3,3,زوجة فرعون تُدعى أسيا
3,3,أسيا هي اسم زوجة فرعون
3,3,يُدعى أسم زوجة فرعون بأسيا
3,3,اسم زوجة فرعون هو أسيا
3,3,يُشار إلى زوجة فرعون بأسم أسيا
3,3,تعرف زوجة فرعون باسم أسيا
3,3,أسيا هي الاسم الذي يطلق على زوجة فرعون
3,,زوجة فرعون معروفة بأسم أسيا
3,3,الاسم الصحيح لزوجة فرعون هو أسيا
3,3,أسية - وفقًا للتراث اليهودي
3,4,زوجة فرعون تُدعى أسية
3,4,أسية هي اسم زوجة فرعون
3,4,يُدعى أسم زوجة فرعون أسية
3,4,اسم زوجة فرعون هو أسية
3,,يُشار إلى زوجة فرعون بأسم أسية
3,4,تعرف زوجة فرعون باسم أسية
3,4,أسية هي الاسم الذي يطلق على زوجة فرعون
3,4,زوجة فرعون معروفة بأسم أسية
3,4,الاسم الصحيح لزوجة فرعون هو أسية
3,0,سارة
3,0,اسم الصحيح لزوجة فرعون هو
3,0,زوجة فرعون
3,0,عائشة
3,0,فاطمة
3,0,خديجة
3,0,مريم
3,0,زينب
3,0,أسماء
3,0,حفصة
3,0,رقية
3,0,صفية
3,0,سمية
3,0,ريحانة
3,0,جويرية
3,0,ميمونة
3,0,هند
3,0,أمينة
3,0,حبيبة
4,5,السيدة خديجة كانت تكبر النبي محمد صلى الله عليه وسلم بخمس عشرة سنة
4,5,السيدة خديجة كانت تكبر النبي محمد صلى الله عليه وسلم بخمسة عشرةعاما
4,5,كانت تكبرالنبي بخمس عشرةعاما
4,5,كانت تكبر النبي ص بخمس عشرةعاما
4,5,كانت تكبر النبي ص بخمس عشرة سنة
4,5,كانت تكبر النبي ص ب15 سنة
4,5,كانت تكبر النبي ص ب15 عشرةعاما
4,5,تكبره ب15 عشرةعاما
4,5,15
4,5,خمسةعشرةعاما
4,5,خمس عشرة سنة
4,5,السيدة خديجة كانت تكبر النبي محمد صلى الله عليه وسلم بخمس عشرة سنة
4,5,السيدة خديجة كانت تكبر النبي محمد صلى الله عليه وسلم بخمسة عشرة عاما
4,5,كانت تكبر النبي بخمس عشرة عاما
4,5,كانت تكبر النبي صلى الله عليه وسلم بخمس عشرة عاما
4,5,كانت تكبر النبي صلى الله عليه وسلم بخمس عشرة سنة
4,5,كانت تكبر النبي صلى الله عليه وسلم بـ15 سنة
4,5,كانت تكبر النبي صلى الله عليه وسلم بـ15 عشرة عاما
4,5,تكبره بـ15 عشرة عاما
4,5,كانت تكبره بـ15 سنة
4,5,كانت تكبره بـ15 عاما
4,5,السيدة خديجة كانت أكبر من النبي محمد صلى الله عليه وسلم بخمس عشرة سنة
4,5,بفارق خمس عشرة سنة، كانت السيدة خديجة أكبر من النبي محمد صلى الله عليه وسلم
4,5,كانت السيدة خديجة تفوق النبي محمد صلى الله عليه وسلم في العمر بخمس عشرة سنة
4,5,كانت السيدة خديجة تفوق النبي محمد صلى الله عليه وسلم في العمر ب  15
4,5,بفارق العمر بينهما البالغ خمس عشرة سنة، كانت السيدة خديجة تكبر النبي محمد صلى الله عليه وسلم
4,5,الفارق العمري بين السيدة خديجة والنبي محمد صلى الله عليه وسلم كان خمس عشرة سنة، حيث كانت تكبره
4,5,كانت السيدة خديجة في مقام الكبر والفضل العمري على النبي محمد صلى الله عليه وسلم بخمس عشرة سنة
4,5,بفضل فارق الأعمار البالغ خمس عشرة سنة، كانت السيدة خديجة تكبر النبي محمد صلى الله عليه وسلم
4,5,السيدة خديجة كانت أكبر سنًا من النبي محمد صلى الله عليه وسلم بخمس عشرة سنة
4,5,كانت السيدة خديجة تفوق النبي محمد صلى الله عليه وسلم في العمر بخمس عشرة سنة كاملة
4,5,الفارق العمري بين السيدة خديجة والنبي محمد صلى الله عليه وسلم كان خمس عشرة سنة تمامًا
4,5,الفارق العمري بين السيدة خديجة والنبي محمد صلى الله عليه وسلم كان خمسة عشر عامًا
4,5,السيدة خديجة تفوق النبي محمد صلى الله عليه وسلم في العمر بخمسة عشر عامًا
4,5,كانت السيدة خديجة أكبر سنًا من النبي محمد صلى الله عليه وسلم بخمسة عشر عامًا
4,5,في الفترة الزمنية بينهما التي تبلغ خمسة عشر عامًا، كانت السيدة خديجة تكبر النبي محمد صلى الله عليه وسلم
4,5,بفضل فجوة العمر التي تبلغ خمسة عشر عامًا، كانت السيدة خديجة تفوق النبي محمد صلى الله عليه وسلم في العمر
4,5,كانت أكبر من النبي محمد صلى الله عليه وسلم بخمسة عشر عامًا كاملة
4,5,كانت السيدة خديجة تفوق النبي محمد صلى الله عليه وسلم في العمر بخمسة عشر عامًا تمامًا
4,5,الفارق العمري بين النبي محمد صلى الله عليه وسلم والسيدة خديجة كان خمسة عشرة عامًا
4,0,السيدة خديجة كانت أصغر من النبي محمد صلى الله عليه وسلم بخمسة عشر عامًا
4,0,16
4,0,كانت السيدة خديجة تفوق النبي 
4,0,كانت أكبر من النبي
4,0,11
4,0,السيدة خديجة كانت تكبر الرسول صلى الله عليه وسلم بـ 30 عامًا
4,0,السيدة خديجة كانت تكبر الرسول صلى الله عليه وسلم بـ 9 عامًا
4,0,بالنسبة للفارق العمري بين السيدة خديجة والرسول صلى الله عليه وسلم، كانت تكبره بـ 9
4,0,كان الرسول صلى الله عليه وسلم أكبر سنًا من السيدة خديجة بـ 15 عامًا
4,0,الرسول صلى الله عليه وسلم كان أصغر من السيدة خديجة بـ 30 عامًا
4,0,السيدة خديجة كانت أصغر من الرسول صلى الله عليه وسلم بعشرين عامًا
4,0,2
4,0,عشرين عامًا
4,0,23
5,4,الثّناء للشّيء فعل ما يشعر بتعظيمه
5,4,الكلام الجميل وفعل ما يُشعر الغير بالتعظيم
5,4,هو ذكر الغير بالخير
5,3,هو المديح
5,5,كل ما يقوم به الفرد من حديث وكلامٍ فيه تعظيم لله عز وجل
5,5,الاعتراف بفضل الله الكبير على البشرية
5,4,ما يذكر في محامد الناس فيتثنى حالا فحالا ذكره
5,3,الدعاء بفضل الله الكبير 
5,3,شكر الله على النعم 
5,3,شكر الله في الدعاء
5,3,الدعاء بأسمائه وصفاته العظيمة
5,4,يناجي الله ويحمده
5,4,الدعاء والتضرع له
5,4,جعل الدعاء لائقاً أكثر أمام الله
5,4,كثرة الدعاء
5,4,شكره على نعمه الكثيرة
5,1,بالصلاة والدعاء
5,1,بالصلاة
5,1,الدعاء الكثير
5,1,الحمد والشكر له
5,1,التأمل في آيات الله والتفكر في خلقه
5,2,التسبيح بحمد الله في جميع الأوقات
5,2,العمل الصالح والخدمة للآخرين
5,2,توجيه الشكر للناس على لطفهم
5,1,الابتسامة ونشر السعادة حولك
5,1,تقديم المساعدة والعون للمحتاجين
5,1,الاستسلام لعظمة الله ورفعه
5,1,تقدير الله وفعل الخير بتوجيهاته
5,1,التأمل في عظمة الخلق وابتهاج بخلق الله
5,1,التفكر في آيات الله وتحديد الفوائد منها
5,2,الاحترام لكل مظهر من مظاهر خلق الله
5,2,الامتنان لرحمة الله في كل لحظة
5,2,الالتفات للطبيعة والإشارة إلى إبداع الخالق
5,2,التواضع والاستشعار بأن كل شيء منح من الله
5,2,الصدق والإخلاص في العمل تحت إشراف الله
5,2,السعي للخيرات باتباع هدي الله
5,3,العمل الدائم على تحسين النفس بمساعدة الله
5,3,الابتهاج بفضائل الله في القرآن
5,3,التفاؤل والثقة بالله في كل الأمور
5,3,الدعاء بالهداية والرحمة للجميع
5,3,النظر إلى السماء والتأمل في عظمة الكون
5,3,الالتزام بالأخلاق الإسلامية في الحياة اليومية
5,3,الدعاء بالشفاء للمرضى والمحتاجين
5,2,العمل الخيري والتبرع بالوقت والمال
5,2,الثقة الكاملة في قدرة الله على حل المشاكل
